<?xml version="1.0" encoding="UTF-8"?>
<tns:implementation
	xmlns:tns="http://httpconnector.coe.cordys.com/2.0/implementation"
	xmlns:xsi="http://www.w3.org/2001/XMLSchema-instance"
	xsi:schemaLocation="http://httpconnector.coe.cordys.com/2.0/implementation implementation.xsd ">
	<tns:connection-id>JIRA</tns:connection-id>
	<tns:uri>/secure/admin/user/UserBrowser.jspa</tns:uri>
	<tns:clean-response-body>true</tns:clean-response-body>
	<tns:http-method>GET</tns:http-method>
	<tns:request-handler
		class="com.cordys.coe.ac.httpconnector.impl.RestRequestHandler">
		<tns:uri-parameters>
			<tns:parameter type="XPATH" />
		</tns:uri-parameters>
	</tns:request-handler>
	<tns:response-handler class="com.cordys.coe.ac.httpconnector.impl.StandardResponseHandler"/>
	<tns:valid-response-code>200</tns:valid-response-code>
	<tns:namespaces>
		<tns:binding prefix="ns" uri="http://httpconnector.coe.cordys.com/2.0/REST/JIRA" />
	</tns:namespaces>
</tns:implementation>

